{
  "primitive_id": "PRIM-x-2088007687149601254-specific-artifact-inbound",
  "name": "SPECIFIC-ARTIFACT-TO-INBOUND",
  "loop": [
    "specific artifact exists",
    "public proof (post / thread / demo) — publish HITL",
    "inbound request for that same class of job",
    "scope is already half-sold",
    "wait"
  ],
  "obvious_demo": "AI automation agency posts builds instead of outbound “I automate your business”",
  "other_applications": [
    "Notes only, do not auto-wire: hive stolen machines as public proof fragments",
    "Path C / us: show one named desk output, not “we do AI”",
    "Not a new hunt list"
  ],
  "capability_ids": ["CAP-x-2088007687149601254-inbound-from-demonstrated-build"],
  "source_video_id": "x-2088007687149601254",
  "timestamp": "51:08-52:38",
  "knowledge_type": "declared",
  "evidence_status": "transcript-implied",
  "status": "UNTESTED"
}
